[
  {
    "conceptId": "B1-U01-PROGRAMA",
    "blockId": "B1",
    "unitId": "U01",
    "name": "Programa",
    "definition": "Conjunto de instrucciones que un ordenador ejecuta para realizar una tarea.",
    "language": "COMMON",
    "priority": "CRITICAL",
    "difficultyMin": 1,
    "difficultyMax": 2,
    "competencies": [
      "R",
      "I"
    ],
    "sourceVersion": "BLOCK1_CANONICAL_V1.0",
    "status": "ACTIVE"
  },
  {
    "conceptId": "B1-U01-CODIGO",
    "blockId": "B1",
    "unitId": "U01",
    "name": "Código",
    "definition": "Instrucciones escritas utilizando un lenguaje de programación.",
    "language": "COMMON",
    "priority": "CRITICAL",
    "difficultyMin": 1,
    "difficultyMax": 2,
    "competencies": [
      "R",
      "I"
    ],
    "sourceVersion": "BLOCK1_CANONICAL_V1.0",
    "status": "ACTIVE"
  },
  {
    "conceptId": "B1-U01-LENGUAJE",
    "blockId": "B1",
    "unitId": "U01",
    "name": "Lenguaje de programación",
    "definition": "Sistema de reglas utilizado para escribir instrucciones ejecutables o interpretables por un ordenador.",
    "language": "COMMON",
    "priority": "HIGH",
    "difficultyMin": 1,
    "difficultyMax": 2,
    "competencies": [
      "R",
      "I"
    ],
    "sourceVersion": "BLOCK1_CANONICAL_V1.0",
    "status": "ACTIVE"
  },
  {
    "conceptId": "B1-U01-INSTRUCCION",
    "blockId": "B1",
    "unitId": "U01",
    "name": "Instrucción",
    "definition": "Acción concreta expresada mediante código.",
    "language": "COMMON",
    "priority": "HIGH",
    "difficultyMin": 1,
    "difficultyMax": 2,
    "competencies": [
      "R",
      "I"
    ],
    "sourceVersion": "BLOCK1_CANONICAL_V1.0",
    "status": "ACTIVE"
  },
  {
    "conceptId": "B1-U02-TERMINAL",
    "blockId": "B1",
    "unitId": "U02",
    "name": "Terminal / consola",
    "definition": "Entorno textual desde el que se introducen y ejecutan comandos.",
    "language": "COMMON",
    "priority": "CRITICAL",
    "difficultyMin": 1,
    "difficultyMax": 2,
    "competencies": [
      "R",
      "I",
      "A"
    ],
    "sourceVersion": "BLOCK1_CANONICAL_V1.0",
    "status": "ACTIVE"
  },
  {
    "conceptId": "B1-U02-COMANDO",
    "blockId": "B1",
    "unitId": "U02",
    "name": "Comando",
    "definition": "Instrucción dirigida al sistema para solicitar una acción.",
    "language": "POWERSHELL",
    "priority": "CRITICAL",
    "difficultyMin": 1,
    "difficultyMax": 3,
    "competencies": [
      "R",
      "I",
      "A"
    ],
    "sourceVersion": "BLOCK1_CANONICAL_V1.0",
    "status": "ACTIVE"
  },
  {
    "conceptId": "B1-U02-CMDLET",
    "blockId": "B1",
    "unitId": "U02",
    "name": "Cmdlet",
    "definition": "Tipo de comando propio de PowerShell.",
    "language": "POWERSHELL",
    "priority": "HIGH",
    "difficultyMin": 1,
    "difficultyMax": 2,
    "competencies": [
      "R",
      "I"
    ],
    "sourceVersion": "BLOCK1_CANONICAL_V1.0",
    "status": "ACTIVE"
  },
  {
    "conceptId": "B1-U02-VERBO-SUSTANTIVO",
    "blockId": "B1",
    "unitId": "U02",
    "name": "Convención Verbo-Sustantivo",
    "definition": "Patrón habitual de nombres de cmdlets de PowerShell, como Get-Location o Set-Location.",
    "language": "POWERSHELL",
    "priority": "MEDIUM",
    "difficultyMin": 1,
    "difficultyMax": 2,
    "competencies": [
      "R",
      "I"
    ],
    "sourceVersion": "BLOCK1_CANONICAL_V1.0",
    "status": "ACTIVE"
  },
  {
    "conceptId": "B1-U02-SCRIPT",
    "blockId": "B1",
    "unitId": "U02",
    "name": "Script",
    "definition": "Archivo que contiene instrucciones guardadas para ejecutarlas y reutilizarlas.",
    "language": "PYTHON_POWERSHELL",
    "priority": "CRITICAL",
    "difficultyMin": 1,
    "difficultyMax": 3,
    "competencies": [
      "R",
      "I",
      "A",
      "D"
    ],
    "sourceVersion": "BLOCK1_CANONICAL_V1.0",
    "status": "ACTIVE"
  },
  {
    "conceptId": "B1-U03-SINTAXIS",
    "blockId": "B1",
    "unitId": "U03",
    "name": "Sintaxis",
    "definition": "Reglas que determinan cómo debe escribirse correctamente el código.",
    "language": "PYTHON_POWERSHELL",
    "priority": "CRITICAL",
    "difficultyMin": 1,
    "difficultyMax": 3,
    "competencies": [
      "R",
      "A",
      "D"
    ],
    "sourceVersion": "BLOCK1_CANONICAL_V1.0",
    "status": "ACTIVE"
  },
  {
    "conceptId": "B1-U03-COMENTARIO",
    "blockId": "B1",
    "unitId": "U03",
    "name": "Comentario",
    "definition": "Texto incluido para explicar o documentar código y que normalmente no se ejecuta.",
    "language": "PYTHON_POWERSHELL",
    "priority": "HIGH",
    "difficultyMin": 1,
    "difficultyMax": 2,
    "competencies": [
      "R",
      "I"
    ],
    "sourceVersion": "BLOCK1_CANONICAL_V1.0",
    "status": "ACTIVE"
  },
  {
    "conceptId": "B1-U03-INDENTACION",
    "blockId": "B1",
    "unitId": "U03",
    "name": "Indentación",
    "definition": "Espacios al inicio de una línea que en Python forman parte de la estructura de los bloques.",
    "language": "PYTHON",
    "priority": "CRITICAL",
    "difficultyMin": 1,
    "difficultyMax": 3,
    "competencies": [
      "R",
      "I",
      "A",
      "D"
    ],
    "sourceVersion": "BLOCK1_CANONICAL_V1.0",
    "status": "ACTIVE"
  },
  {
    "conceptId": "B1-U04-VARIABLE",
    "blockId": "B1",
    "unitId": "U04",
    "name": "Variable",
    "definition": "Nombre utilizado para almacenar y reutilizar un valor.",
    "language": "PYTHON_POWERSHELL",
    "priority": "CRITICAL",
    "difficultyMin": 1,
    "difficultyMax": 3,
    "competencies": [
      "R",
      "I",
      "A",
      "D"
    ],
    "sourceVersion": "BLOCK1_CANONICAL_V1.0",
    "status": "ACTIVE"
  },
  {
    "conceptId": "B1-U04-ASIGNACION",
    "blockId": "B1",
    "unitId": "U04",
    "name": "Asignación",
    "definition": "Operación de guardar un valor en una variable.",
    "language": "PYTHON_POWERSHELL",
    "priority": "CRITICAL",
    "difficultyMin": 1,
    "difficultyMax": 3,
    "competencies": [
      "R",
      "I",
      "A",
      "D"
    ],
    "sourceVersion": "BLOCK1_CANONICAL_V1.0",
    "status": "ACTIVE"
  },
  {
    "conceptId": "B1-U04-STRING",
    "blockId": "B1",
    "unitId": "U04",
    "name": "String",
    "definition": "Cadena de texto.",
    "language": "PYTHON_POWERSHELL",
    "priority": "HIGH",
    "difficultyMin": 1,
    "difficultyMax": 2,
    "competencies": [
      "R",
      "I",
      "A"
    ],
    "sourceVersion": "BLOCK1_CANONICAL_V1.0",
    "status": "ACTIVE"
  },
  {
    "conceptId": "B1-U04-ENTERO",
    "blockId": "B1",
    "unitId": "U04",
    "name": "Entero",
    "definition": "Número sin parte decimal.",
    "language": "PYTHON_POWERSHELL",
    "priority": "HIGH",
    "difficultyMin": 1,
    "difficultyMax": 2,
    "competencies": [
      "R",
      "I"
    ],
    "sourceVersion": "BLOCK1_CANONICAL_V1.0",
    "status": "ACTIVE"
  },
  {
    "conceptId": "B1-U04-DECIMAL",
    "blockId": "B1",
    "unitId": "U04",
    "name": "Decimal / float",
    "definition": "Número con parte decimal.",
    "language": "PYTHON_POWERSHELL",
    "priority": "HIGH",
    "difficultyMin": 1,
    "difficultyMax": 2,
    "competencies": [
      "R",
      "I"
    ],
    "sourceVersion": "BLOCK1_CANONICAL_V1.0",
    "status": "ACTIVE"
  },
  {
    "conceptId": "B1-U04-BOOLEANO",
    "blockId": "B1",
    "unitId": "U04",
    "name": "Booleano",
    "definition": "Dato lógico que representa verdadero o falso.",
    "language": "PYTHON_POWERSHELL",
    "priority": "CRITICAL",
    "difficultyMin": 2,
    "difficultyMax": 3,
    "competencies": [
      "R",
      "I",
      "A",
      "D"
    ],
    "sourceVersion": "BLOCK1_CANONICAL_V1.0",
    "status": "ACTIVE"
  },
  {
    "conceptId": "B1-U05-ENTRADA",
    "blockId": "B1",
    "unitId": "U05",
    "name": "Entrada",
    "definition": "Información que recibe un programa.",
    "language": "PYTHON_POWERSHELL",
    "priority": "CRITICAL",
    "difficultyMin": 1,
    "difficultyMax": 3,
    "competencies": [
      "R",
      "I",
      "A"
    ],
    "sourceVersion": "BLOCK1_CANONICAL_V1.0",
    "status": "ACTIVE"
  },
  {
    "conceptId": "B1-U05-PROCESAMIENTO",
    "blockId": "B1",
    "unitId": "U05",
    "name": "Procesamiento",
    "definition": "Operaciones que un programa realiza sobre los datos.",
    "language": "COMMON",
    "priority": "HIGH",
    "difficultyMin": 1,
    "difficultyMax": 3,
    "competencies": [
      "R",
      "I",
      "A"
    ],
    "sourceVersion": "BLOCK1_CANONICAL_V1.0",
    "status": "ACTIVE"
  },
  {
    "conceptId": "B1-U05-SALIDA",
    "blockId": "B1",
    "unitId": "U05",
    "name": "Salida",
    "definition": "Información producida o mostrada por un programa.",
    "language": "PYTHON_POWERSHELL",
    "priority": "CRITICAL",
    "difficultyMin": 1,
    "difficultyMax": 2,
    "competencies": [
      "R",
      "I",
      "A"
    ],
    "sourceVersion": "BLOCK1_CANONICAL_V1.0",
    "status": "ACTIVE"
  },
  {
    "conceptId": "B1-U05-EPS",
    "blockId": "B1",
    "unitId": "U05",
    "name": "Entrada → Procesamiento → Salida",
    "definition": "Modelo básico de flujo de información de un programa.",
    "language": "COMMON",
    "priority": "CRITICAL",
    "difficultyMin": 1,
    "difficultyMax": 3,
    "competencies": [
      "R",
      "I",
      "A"
    ],
    "sourceVersion": "BLOCK1_CANONICAL_V1.0",
    "status": "ACTIVE"
  },
  {
    "conceptId": "B1-U06-OPERADORES",
    "blockId": "B1",
    "unitId": "U06",
    "name": "Operadores matemáticos",
    "definition": "Símbolos básicos para suma, resta, multiplicación y división.",
    "language": "PYTHON_POWERSHELL",
    "priority": "CRITICAL",
    "difficultyMin": 1,
    "difficultyMax": 3,
    "competencies": [
      "R",
      "I",
      "A",
      "D"
    ],
    "sourceVersion": "BLOCK1_CANONICAL_V1.0",
    "status": "ACTIVE"
  },
  {
    "conceptId": "B1-U06-EXPRESION",
    "blockId": "B1",
    "unitId": "U06",
    "name": "Expresión",